,name,rating,ingredients,flavor,price
0,Crunchy Protein Bar (12x64g),5.0,"Schokoladen Brownie: 31% Milchschokoladenüberzug mit Süßungsmittel (Süßungsmittel: Maltit; Kakaobutter, Vollmilchpulver, Kakaomasse, Emulgator: Lecithine (Soja), Vanilleextrakt), Milchprotein, Süßungsmittel: Maltit; Kollagenhydrolysat, 8,6% Kakao-Soja-Crispies (Sojaprotein, Kakaopulver, Tapiokastärke), Feuchthaltemittel: Glycerin, Sorbit; Kondensmilch, Wasser, Sojaprotein, Kokosfett, 1,6% weiße Schokolade mit Süßungsmittel (Süßungsmittel: Maltit; Kakaobutter, Vollmilchpulver, Emulgator: Lecithine; Aroma), fettreduziertes Kakaopulver, Kakaobutter, Aroma, Emulgator: Mono- und Diglyceride von Speisefettsäuren; Salz, Farbstoff: Zuckerkulör. Cookies & Cream: 31% Milchschokoladenüberzug mit Süßungsmittel (Süßungsmittel: Maltit; Kakaobutter, Vollmilchpulver, Kakaomasse, Emulgator: Lecithine (Soja); Vanilleextrakt), Milcheiweiß, Süßungsmittel: Maltit; 8,6% Soja-Crispies (Sojaeiweiß, Reismehl, Gerstenmalzextrakt, Speisesalz), Kollagenhydrolysat, Feuchthaltemittel: Glycerin, Sorbit; Kondensmilch, Wasser, Sojaeiweiß, Kokosfett, 1,6% weiße Schokolade mit Süßungsmittel (Süßungsmittel: Maltit; Kakaobutter, Vollmilchpulver, Emulgator: Lecithine; natürliches Bourbon-Vanille-Aroma), Kakaobutter, Aroma (enthält Milch), Emulgator: Mono- und Diglyceride von Speisefettsäuren; Speisesalz, Farbstoff: Zuckerkulör.",Option wählen…,"16,16 €"
1,Crunchy Protein Bar (12x64g),5.0,"Schokoladen Brownie: 31% Milchschokoladenüberzug mit Süßungsmittel (Süßungsmittel: Maltit; Kakaobutter, Vollmilchpulver, Kakaomasse, Emulgator: Lecithine (Soja), Vanilleextrakt), Milchprotein, Süßungsmittel: Maltit; Kollagenhydrolysat, 8,6% Kakao-Soja-Crispies (Sojaprotein, Kakaopulver, Tapiokastärke), Feuchthaltemittel: Glycerin, Sorbit; Kondensmilch, Wasser, Sojaprotein, Kokosfett, 1,6% weiße Schokolade mit Süßungsmittel (Süßungsmittel: Maltit; Kakaobutter, Vollmilchpulver, Emulgator: Lecithine; Aroma), fettreduziertes Kakaopulver, Kakaobutter, Aroma, Emulgator: Mono- und Diglyceride von Speisefettsäuren; Salz, Farbstoff: Zuckerkulör. Cookies & Cream: 31% Milchschokoladenüberzug mit Süßungsmittel (Süßungsmittel: Maltit; Kakaobutter, Vollmilchpulver, Kakaomasse, Emulgator: Lecithine (Soja); Vanilleextrakt), Milcheiweiß, Süßungsmittel: Maltit; 8,6% Soja-Crispies (Sojaeiweiß, Reismehl, Gerstenmalzextrakt, Speisesalz), Kollagenhydrolysat, Feuchthaltemittel: Glycerin, Sorbit; Kondensmilch, Wasser, Sojaeiweiß, Kokosfett, 1,6% weiße Schokolade mit Süßungsmittel (Süßungsmittel: Maltit; Kakaobutter, Vollmilchpulver, Emulgator: Lecithine; natürliches Bourbon-Vanille-Aroma), Kakaobutter, Aroma (enthält Milch), Emulgator: Mono- und Diglyceride von Speisefettsäuren; Speisesalz, Farbstoff: Zuckerkulör.",Option wählen…,"16,16 €"
2,Whey Protein (2000g),3.9,"Vanille: Cross-flow ultra filtriertes Molkenprotein-Konzentrat, Molkenprotein-Isolat und hydrolysiertes Molkenprotein (Milcheiweiß, Laktose), Sojalecithin, Süßstoff: Acesulfam-K und Sucralose, Sicliciumdioxid, Aroma, Zitronensäure.Banane: Cross-flow ultra filtriertes Molkenprotein-Konzentrat, Molkenprotein-Isolat und hydrolysiertes Molkenprotein (Milcheiweiß, Laktose), Sojalecithin, Süßstoff: Acesulfam-K und Sucralose, Sicliciumdioxid, Aroma, Zitronensäure, Farbe: ß-Carotin.Erdbeer: Cross-flow ultra filtriertes Molkenprotein-Konzentrat, Molkenprotein-Isolat und hydrolysiertes Molkenprotein (Milcheiweiß, Laktose), Sojalecithin, Süßstoff: Acesulfam-K und Sucralose,Sicliciumdioxid,  Aroma, Zitronensäure, Farbe: Karmin.Neutral: Cross-flow ultra filtriertes Molkenprotein-Konzentrat, Molkenprotein-Isolat und hydrolysiertes Molkenprotein (Milcheiweiß, Laktose), Sojalecithin.Kokosnuss: Cross-flow ultra filtriertes Molkenprotein-Konzentrat, Molkenprotein-Isolat und hydrolysiertes Molkenprotein (Milcheiweiß, Laktose), Sojalecithin, Süßstoff: Acesulfam-K und Sucralose, Sicliciumdioxid, Aroma, Zitronensäure.Blaubeere: Cross-flow ultra filtriertes Molkenprotein-Konzentrat, Molkenprotein-Isolat und hydrolysiertes Molkenprotein (Milcheiweiß, Laktose), Sojalecithin, Süßstoff: Acesulfam-K und Sucralose, Sicliciumdioxid, Aroma, Zitronensäure, Farbe: Karmin und Brilliantblau (E133).Ananas: Cross-flow ultra filtriertes Molkenprotein-Konzentrat, Molkenprotein-Isolat und hydrolysiertes Molkenprotein (Milcheiweiß, Laktose), Sojalecithin, Süßstoff: Acesulfam-K und Sucralose, Sicliciumdioxid, Aroma, Zitronensäure.Schokolade: Cross-flow ultra filtriertes Molkenprotein-Konzentrat, Molkenprotein-Isolat und hydrolysiertes Molkenprotein (Milcheiweiß, Laktose), Sojalecithin, Süßstoff: Acesulfam-K und Sucralose, Sicliciumdioxid, Kakao, Aroma, Farbstoff: Karamell und Karmin.Haselnuss-Schokolade: Cross-flow ultra filtriertes Molkenprotein-Konzentrat, Molkenprotein-Isolat und hydrolysiertes Molkenprotein (Milcheiweiß, Laktose), Sojalecithin, Süßstoff: Acesulfam-K und Sucralose, Sicliciumdioxid, Kakao, Aroma.Cookies & Cream: Cross-flow ultra filtriertes Molkenprotein-Konzentrat, Molkenprotein-Isolat und hydrolysiertes Molkenprotein (Milcheiweiß, Laktose), Sojalecithin, Süßstoff: Acesulfam-K und Sucralose, Sicliciumdioxid, Kuchenstücke 4% (Kakao, Weizen (Gluten), pflanzliches Fett, Zucker, Farbstoff: Karamell), Aromen, Xanthan, Salz, Farbstoff: Karmin.Schokolade-Kokosnuss: Cross-flow ultra filtriertes Molkenprotein-Konzentrat, Molkenprotein-Isolat und hydrolysiertes Molkenprotein (Milcheiweiß, Laktose), Sojalecithin, Süßstoff: Acesulfam-K und Sucralose, Sicliciumdioxid, Kakao, Aroma, Farbstoff: Karamell und Karmin.Latte Macchiato: Cross-flow ultra filtriertes Molkenprotein-Konzentrat, Molkenprotein-Isolat und hydrolysiertes Molkenprotein (Milcheiweiß, Laktose), Sojalecithin, Süßstoff: Acesulfam-K und Sucralose, Sicliciumdioxid,  Kaffee, Aroma, Farbstoff: Karamell.Pistazie: Cross-flow ultra filtriertes Molkenprotein-Konzentrat, Molkenprotein-Isolat und hydrolysiertes Molkenprotein (Milcheiweiß, Laktose), Sojalecithin, Süßstoff: Acesulfam-K und Sucralose, Sicliciumdioxid, Aroma, Farbe: Kupfer Chlorophyllin.Himbeer-Joghurt: Cross-flow ultra filtriertes Molkenprotein-Konzentrat, Molkenprotein-Isolat und hydrolysiertes Molkenprotein (Milcheiweiß, Laktose), Sojalecithin, Süßstoff: Acesulfam-K und Sucralose, Sicliciumdioxid,  Dextrose, Aroma, Zitronensäure, Farbe: Karmin.Kirsch-Joghurt: Cross-flow ultra filtriertes Molkenprotein-Konzentrat, Molkenprotein-Isolat und hydrolysiertes Molkenprotein (Milcheiweiß, Laktose), Sojalecithin, Süßstoff: Acesulfam-K und Sucralose, Sicliciumdioxid, Aroma, Zitronensäure, Farbstoff: Karminrot.Tropical: Cross-flow ultra filtriertes Molkenprotein-Konzentrat, Molkenprotein-Isolat und hydrolysiertes Molkenprotein (Milcheiweiß, Laktose), Sojalecithin, Süßstoff: Acesulfam-K und Sucralose, Sicliciumdioxid, Aroma, Zitronensäure, Farbstoff: Beta-Carotin.S'mores: Cross-flow ultra filtriertes Molkenprotein-Konzentrat, Molkenprotein-Isolat und hydrolysiertes Molkenprotein (Milcheiweiß, Laktose), Sojalecithin, Süßstoff: Acesulfam-K und Sucralose, Sicliciumdioxid, Kakao, Aroma, Zimt.Joghurt-Passionsfrucht: Cross-flow ultra filtriertes Molkenprotein-Konzentrat, Molkenprotein-Isolat und hydrolysiertes Molkenprotein (Milcheiweiß, Laktose), Sojalecithin, Süßstoff: Acesulfam-K und Sucralose, Sicliciumdioxid, Aroma, Zitronensäure, Farbstoff: Karotin.Lemon Cheesecake: Cross-flow ultra filtriertes Molkenprotein-Konzentrat, Molkenprotein-Isolat und hydrolysiertes Molkenprotein (Milcheiweiß, Laktose), Sojalecithin, Süßstoff: Acesulfam-K und Sucralose, Sicliciumdioxid, Dextrose, Aroma, Zitronensäure.Chai Latte: Cross-flow ultra filtriertes Molkenprotein-Konzentrat, Molkenprotein-Isolat und hydrolysiertes Molkenprotein (Milcheiweiß, Laktose), Sojalecithin, Süßstoff: Acesulfam-K und Sucralose, Sicliciumdioxid, Tee Extrakt, Aroma, Zimt.Waldfrucht Cheesecake: Cross-flow ultra filtriertes Molkenprotein-Konzentrat, Molkenprotein-Isolat und hydrolysiertes Molkenprotein (Milcheiweiß, Laktose), Sojalecithin, Süßstoff: Acesulfam-K und Sucralose, Sicliciumdioxid, Dextrose, Aroma, Zitronensäure, Farbstoff: Karmin.",Option wählen…,"25,00 €"
3,Whey Protein (2000g),3.9,"Vanille: Cross-flow ultra filtriertes Molkenprotein-Konzentrat, Molkenprotein-Isolat und hydrolysiertes Molkenprotein (Milcheiweiß, Laktose), Sojalecithin, Süßstoff: Acesulfam-K und Sucralose, Sicliciumdioxid, Aroma, Zitronensäure.Banane: Cross-flow ultra filtriertes Molkenprotein-Konzentrat, Molkenprotein-Isolat und hydrolysiertes Molkenprotein (Milcheiweiß, Laktose), Sojalecithin, Süßstoff: Acesulfam-K und Sucralose, Sicliciumdioxid, Aroma, Zitronensäure, Farbe: ß-Carotin.Erdbeer: Cross-flow ultra filtriertes Molkenprotein-Konzentrat, Molkenprotein-Isolat und hydrolysiertes Molkenprotein (Milcheiweiß, Laktose), Sojalecithin, Süßstoff: Acesulfam-K und Sucralose,Sicliciumdioxid,  Aroma, Zitronensäure, Farbe: Karmin.Neutral: Cross-flow ultra filtriertes Molkenprotein-Konzentrat, Molkenprotein-Isolat und hydrolysiertes Molkenprotein (Milcheiweiß, Laktose), Sojalecithin.Kokosnuss: Cross-flow ultra filtriertes Molkenprotein-Konzentrat, Molkenprotein-Isolat und hydrolysiertes Molkenprotein (Milcheiweiß, Laktose), Sojalecithin, Süßstoff: Acesulfam-K und Sucralose, Sicliciumdioxid, Aroma, Zitronensäure.Blaubeere: Cross-flow ultra filtriertes Molkenprotein-Konzentrat, Molkenprotein-Isolat und hydrolysiertes Molkenprotein (Milcheiweiß, Laktose), Sojalecithin, Süßstoff: Acesulfam-K und Sucralose, Sicliciumdioxid, Aroma, Zitronensäure, Farbe: Karmin und Brilliantblau (E133).Ananas: Cross-flow ultra filtriertes Molkenprotein-Konzentrat, Molkenprotein-Isolat und hydrolysiertes Molkenprotein (Milcheiweiß, Laktose), Sojalecithin, Süßstoff: Acesulfam-K und Sucralose, Sicliciumdioxid, Aroma, Zitronensäure.Schokolade: Cross-flow ultra filtriertes Molkenprotein-Konzentrat, Molkenprotein-Isolat und hydrolysiertes Molkenprotein (Milcheiweiß, Laktose), Sojalecithin, Süßstoff: Acesulfam-K und Sucralose, Sicliciumdioxid, Kakao, Aroma, Farbstoff: Karamell und Karmin.Haselnuss-Schokolade: Cross-flow ultra filtriertes Molkenprotein-Konzentrat, Molkenprotein-Isolat und hydrolysiertes Molkenprotein (Milcheiweiß, Laktose), Sojalecithin, Süßstoff: Acesulfam-K und Sucralose, Sicliciumdioxid, Kakao, Aroma.Cookies & Cream: Cross-flow ultra filtriertes Molkenprotein-Konzentrat, Molkenprotein-Isolat und hydrolysiertes Molkenprotein (Milcheiweiß, Laktose), Sojalecithin, Süßstoff: Acesulfam-K und Sucralose, Sicliciumdioxid, Kuchenstücke 4% (Kakao, Weizen (Gluten), pflanzliches Fett, Zucker, Farbstoff: Karamell), Aromen, Xanthan, Salz, Farbstoff: Karmin.Schokolade-Kokosnuss: Cross-flow ultra filtriertes Molkenprotein-Konzentrat, Molkenprotein-Isolat und hydrolysiertes Molkenprotein (Milcheiweiß, Laktose), Sojalecithin, Süßstoff: Acesulfam-K und Sucralose, Sicliciumdioxid, Kakao, Aroma, Farbstoff: Karamell und Karmin.Latte Macchiato: Cross-flow ultra filtriertes Molkenprotein-Konzentrat, Molkenprotein-Isolat und hydrolysiertes Molkenprotein (Milcheiweiß, Laktose), Sojalecithin, Süßstoff: Acesulfam-K und Sucralose, Sicliciumdioxid,  Kaffee, Aroma, Farbstoff: Karamell.Pistazie: Cross-flow ultra filtriertes Molkenprotein-Konzentrat, Molkenprotein-Isolat und hydrolysiertes Molkenprotein (Milcheiweiß, Laktose), Sojalecithin, Süßstoff: Acesulfam-K und Sucralose, Sicliciumdioxid, Aroma, Farbe: Kupfer Chlorophyllin.Himbeer-Joghurt: Cross-flow ultra filtriertes Molkenprotein-Konzentrat, Molkenprotein-Isolat und hydrolysiertes Molkenprotein (Milcheiweiß, Laktose), Sojalecithin, Süßstoff: Acesulfam-K und Sucralose, Sicliciumdioxid,  Dextrose, Aroma, Zitronensäure, Farbe: Karmin.Kirsch-Joghurt: Cross-flow ultra filtriertes Molkenprotein-Konzentrat, Molkenprotein-Isolat und hydrolysiertes Molkenprotein (Milcheiweiß, Laktose), Sojalecithin, Süßstoff: Acesulfam-K und Sucralose, Sicliciumdioxid, Aroma, Zitronensäure, Farbstoff: Karminrot.Tropical: Cross-flow ultra filtriertes Molkenprotein-Konzentrat, Molkenprotein-Isolat und hydrolysiertes Molkenprotein (Milcheiweiß, Laktose), Sojalecithin, Süßstoff: Acesulfam-K und Sucralose, Sicliciumdioxid, Aroma, Zitronensäure, Farbstoff: Beta-Carotin.S'mores: Cross-flow ultra filtriertes Molkenprotein-Konzentrat, Molkenprotein-Isolat und hydrolysiertes Molkenprotein (Milcheiweiß, Laktose), Sojalecithin, Süßstoff: Acesulfam-K und Sucralose, Sicliciumdioxid, Kakao, Aroma, Zimt.Joghurt-Passionsfrucht: Cross-flow ultra filtriertes Molkenprotein-Konzentrat, Molkenprotein-Isolat und hydrolysiertes Molkenprotein (Milcheiweiß, Laktose), Sojalecithin, Süßstoff: Acesulfam-K und Sucralose, Sicliciumdioxid, Aroma, Zitronensäure, Farbstoff: Karotin.Lemon Cheesecake: Cross-flow ultra filtriertes Molkenprotein-Konzentrat, Molkenprotein-Isolat und hydrolysiertes Molkenprotein (Milcheiweiß, Laktose), Sojalecithin, Süßstoff: Acesulfam-K und Sucralose, Sicliciumdioxid, Dextrose, Aroma, Zitronensäure.Chai Latte: Cross-flow ultra filtriertes Molkenprotein-Konzentrat, Molkenprotein-Isolat und hydrolysiertes Molkenprotein (Milcheiweiß, Laktose), Sojalecithin, Süßstoff: Acesulfam-K und Sucralose, Sicliciumdioxid, Tee Extrakt, Aroma, Zimt.Waldfrucht Cheesecake: Cross-flow ultra filtriertes Molkenprotein-Konzentrat, Molkenprotein-Isolat und hydrolysiertes Molkenprotein (Milcheiweiß, Laktose), Sojalecithin, Süßstoff: Acesulfam-K und Sucralose, Sicliciumdioxid, Dextrose, Aroma, Zitronensäure, Farbstoff: Karmin.",Option wählen…,"25,00 €"
4,,,,Option wählen…,
5,,,,Option wählen…,
6,Whey Protein (1000g),3.9,"Erdbeer: Cross-flow ultra filtriertes Molkenprotein-Konzentrat, Molkenprotein-Isolat und hydrolysiertes Molkenprotein (Milcheiweiß, Laktose), Sojalecithin, Süßstoff: Acesulfam-K und Sucralose, Aroma, Zitronensäure, Farbe: Karmin.Neutral: Cross-flow ultra filtriertes Molkenprotein-Konzentrat, Molkenprotein-Isolat und hydrolysiertes Molkenprotein (Milcheiweiß, Laktose), Sojalecithin.Vanille: Cross-flow ultra filtriertes Molkenprotein-Konzentrat, Molkenprotein-Isolat und hydrolysiertes Molkenprotein (Milcheiweiß, Laktose), Sojalecithin, Süßstoff: Acesulfam-K und Sucralose, Aroma, Zitronensäure.Banane: Cross-flow ultra filtriertes Molkenprotein-Konzentrat, Molkenprotein-Isolat und hydrolysiertes Molkenprotein (Milcheiweiß, Laktose), Sojalecithin, Süßstoff: Acesulfam-K und Sucralose, Aroma, Zitronensäure, Farbe: ß-Carotin.Kokosnuss: Cross-flow ultra filtriertes Molkenprotein-Konzentrat, Molkenprotein-Isolat und hydrolysiertes Molkenprotein (Milcheiweiß, Laktose), Sojalecithin, Süßstoff: Acesulfam-K und Sucralose, Aroma, Zitronensäure.Blaubeere: Cross-flow ultra filtriertes Molkenprotein-Konzentrat, Molkenprotein-Isolat und hydrolysiertes Molkenprotein (Milcheiweiß, Laktose), Sojalecithin, Süßstoff: Acesulfam-K und Sucralose, Aroma, Zitronensäure, Farbe: Karmin und Brilliantblau (E133).Cookies & Cream: Cross-flow ultra filtriertes Molkenprotein-Konzentrat, Molkenprotein-Isolat und hydrolysiertes Molkenprotein (Milcheiweiß, Laktose), Sojalecithin, Süßstoff: Acesulfam-K und Sucralose, Kuchenstücke 4% (Kakao, Weizen (Gluten), pflanzliches Fett, Zucker, Farbstoff: Karamell), Aromen, Xanthan, Salz, Farbstoff: Karmin.Schokolade: Cross-flow ultra filtriertes Molkenprotein-Konzentrat, Molkenprotein-Isolat und hydrolysiertes Molkenprotein (Milcheiweiß, Laktose), Sojalecithin, Süßstoff: Acesulfam-K und Sucralose, Kakao, Aroma, Farbstoff: Karamell und Karmin.Haselnuss-Schokolade: Cross-flow ultra filtriertes Molkenprotein-Konzentrat, Molkenprotein-Isolat und hydrolysiertes Molkenprotein (Milcheiweiß, Laktose), Sojalecithin, Süßstoff: Acesulfam-K und Sucralose, Kakao, Aroma.Schokolade-Kokosnuss: Cross-flow ultra filtriertes Molkenprotein-Konzentrat, Molkenprotein-Isolat und hydrolysiertes Molkenprotein (Milcheiweiß, Laktose), Sojalecithin, Süßstoff: Acesulfam-K und Sucralose, Kakao, Aroma, Farbstoff: Karamell und Karmin.Himbeer-Joghurt: Cross-flow ultra filtriertes Molkenprotein-Konzentrat, Molkenprotein-Isolat und hydrolysiertes Molkenprotein (Milcheiweiß, Laktose), Sojalecithin, Süßstoff: Acesulfam-K und Sucralose, Dextrose, Aroma, Zitronensäure, Farbe: Karmin.Kirsch-Joghurt: Cross-flow ultra filtriertes Molkenprotein-Konzentrat, Molkenprotein-Isolat und hydrolysiertes Molkenprotein (Milcheiweiß, Laktose), Sojalecithin, Süßstoff: Acesulfam-K und Sucralose, Aroma, Zitronensäure, Farbstoff: Karminrot.Pistazie: Cross-flow ultra filtriertes Molkenprotein-Konzentrat, Molkenprotein-Isolat und hydrolysiertes Molkenprotein (Milcheiweiß, Laktose), Sojalecithin, Süßstoff: Acesulfam-K und Sucralose, Aroma, Farbe: Kupfer Chlorophyllin.Latte Macchiato: Cross-flow ultra filtriertes Molkenprotein-Konzentrat, Molkenprotein-Isolat und hydrolysiertes Molkenprotein (Milcheiweiß, Laktose), Sojalecithin, Süßstoff: Acesulfam-K und Sucralose, Kaffee, Aroma, Farbstoff: Karamell.",Option wählen…,"25,00 €"
7,Whey Protein (1000g),3.9,"Erdbeer: Cross-flow ultra filtriertes Molkenprotein-Konzentrat, Molkenprotein-Isolat und hydrolysiertes Molkenprotein (Milcheiweiß, Laktose), Sojalecithin, Süßstoff: Acesulfam-K und Sucralose, Aroma, Zitronensäure, Farbe: Karmin.Neutral: Cross-flow ultra filtriertes Molkenprotein-Konzentrat, Molkenprotein-Isolat und hydrolysiertes Molkenprotein (Milcheiweiß, Laktose), Sojalecithin.Vanille: Cross-flow ultra filtriertes Molkenprotein-Konzentrat, Molkenprotein-Isolat und hydrolysiertes Molkenprotein (Milcheiweiß, Laktose), Sojalecithin, Süßstoff: Acesulfam-K und Sucralose, Aroma, Zitronensäure.Banane: Cross-flow ultra filtriertes Molkenprotein-Konzentrat, Molkenprotein-Isolat und hydrolysiertes Molkenprotein (Milcheiweiß, Laktose), Sojalecithin, Süßstoff: Acesulfam-K und Sucralose, Aroma, Zitronensäure, Farbe: ß-Carotin.Kokosnuss: Cross-flow ultra filtriertes Molkenprotein-Konzentrat, Molkenprotein-Isolat und hydrolysiertes Molkenprotein (Milcheiweiß, Laktose), Sojalecithin, Süßstoff: Acesulfam-K und Sucralose, Aroma, Zitronensäure.Blaubeere: Cross-flow ultra filtriertes Molkenprotein-Konzentrat, Molkenprotein-Isolat und hydrolysiertes Molkenprotein (Milcheiweiß, Laktose), Sojalecithin, Süßstoff: Acesulfam-K und Sucralose, Aroma, Zitronensäure, Farbe: Karmin und Brilliantblau (E133).Cookies & Cream: Cross-flow ultra filtriertes Molkenprotein-Konzentrat, Molkenprotein-Isolat und hydrolysiertes Molkenprotein (Milcheiweiß, Laktose), Sojalecithin, Süßstoff: Acesulfam-K und Sucralose, Kuchenstücke 4% (Kakao, Weizen (Gluten), pflanzliches Fett, Zucker, Farbstoff: Karamell), Aromen, Xanthan, Salz, Farbstoff: Karmin.Schokolade: Cross-flow ultra filtriertes Molkenprotein-Konzentrat, Molkenprotein-Isolat und hydrolysiertes Molkenprotein (Milcheiweiß, Laktose), Sojalecithin, Süßstoff: Acesulfam-K und Sucralose, Kakao, Aroma, Farbstoff: Karamell und Karmin.Haselnuss-Schokolade: Cross-flow ultra filtriertes Molkenprotein-Konzentrat, Molkenprotein-Isolat und hydrolysiertes Molkenprotein (Milcheiweiß, Laktose), Sojalecithin, Süßstoff: Acesulfam-K und Sucralose, Kakao, Aroma.Schokolade-Kokosnuss: Cross-flow ultra filtriertes Molkenprotein-Konzentrat, Molkenprotein-Isolat und hydrolysiertes Molkenprotein (Milcheiweiß, Laktose), Sojalecithin, Süßstoff: Acesulfam-K und Sucralose, Kakao, Aroma, Farbstoff: Karamell und Karmin.Himbeer-Joghurt: Cross-flow ultra filtriertes Molkenprotein-Konzentrat, Molkenprotein-Isolat und hydrolysiertes Molkenprotein (Milcheiweiß, Laktose), Sojalecithin, Süßstoff: Acesulfam-K und Sucralose, Dextrose, Aroma, Zitronensäure, Farbe: Karmin.Kirsch-Joghurt: Cross-flow ultra filtriertes Molkenprotein-Konzentrat, Molkenprotein-Isolat und hydrolysiertes Molkenprotein (Milcheiweiß, Laktose), Sojalecithin, Süßstoff: Acesulfam-K und Sucralose, Aroma, Zitronensäure, Farbstoff: Karminrot.Pistazie: Cross-flow ultra filtriertes Molkenprotein-Konzentrat, Molkenprotein-Isolat und hydrolysiertes Molkenprotein (Milcheiweiß, Laktose), Sojalecithin, Süßstoff: Acesulfam-K und Sucralose, Aroma, Farbe: Kupfer Chlorophyllin.Latte Macchiato: Cross-flow ultra filtriertes Molkenprotein-Konzentrat, Molkenprotein-Isolat und hydrolysiertes Molkenprotein (Milcheiweiß, Laktose), Sojalecithin, Süßstoff: Acesulfam-K und Sucralose, Kaffee, Aroma, Farbstoff: Karamell.",Option wählen…,"25,00 €"
8,,,,Option wählen…,
9,,,,Option wählen…,
10,,,,Option wählen…,
11,,,,Option wählen…,
12,Eat Clean Protein Bar (12x65g),4.0,"Cookie Dough: Milcheiweiß, Isomalto-Oligosaccharide, Füllstoff: (Polydextrose), Oligofructose, Kakaomasse 7,4% Sonnenblumenöl, fettreduzierter Kakao, Aromen, Salz, Süßstoff (Steviol Glykoside).Erdnuss-Karamell: Milcheiweiß, Isomalto-Oligosaccharide, Füllstoff: (Polydextrose), Oligofructose, Sonnenblumenöl, Kakaobohnen, Keks 3,2% (Weizenmehl (Gluten), Pflanzenöl (Rapsöl, Palmöl), Zucker, Salz, Natriumcarbonat, Ammoniumcarbonat), fettreduzierter Kakao, Aroma, Salz, Süßstoff (Steviol Glykoside).Double Choco: Milcheiweiß, Isomalto-Oligosaccharide, Füllstoff: (Polydextrose), Oligofructose, Kakaomasse 11,9%, fettreduzierter Kakao, Kakao Nibs 3,1%, Aroma, Salz, Süßstoff (Steviol Glykoside).Cookies & Cream: Milcheiweiß, Isomalto-Oligosaccharide, Füllstoff: (Polydextrose), Oligofructose, Sonnenblumenöl, Kakao Nibs, Keks 3,2% (Weizenmehl (Gluten), Pflanzenöl (Rapsöl, Palmöl), Zucker, Salz, Natriumcarbonat, Ammoniumcarbonat), fettreduzierter Kakao, Aroma, Salz, Süßstoff (Steviol Glykoside).",Option wählen…,"16,16 €"
13,Eat Clean Protein Bar (12x65g),4.0,"Cookie Dough: Milcheiweiß, Isomalto-Oligosaccharide, Füllstoff: (Polydextrose), Oligofructose, Kakaomasse 7,4% Sonnenblumenöl, fettreduzierter Kakao, Aromen, Salz, Süßstoff (Steviol Glykoside).Erdnuss-Karamell: Milcheiweiß, Isomalto-Oligosaccharide, Füllstoff: (Polydextrose), Oligofructose, Sonnenblumenöl, Kakaobohnen, Keks 3,2% (Weizenmehl (Gluten), Pflanzenöl (Rapsöl, Palmöl), Zucker, Salz, Natriumcarbonat, Ammoniumcarbonat), fettreduzierter Kakao, Aroma, Salz, Süßstoff (Steviol Glykoside).Double Choco: Milcheiweiß, Isomalto-Oligosaccharide, Füllstoff: (Polydextrose), Oligofructose, Kakaomasse 11,9%, fettreduzierter Kakao, Kakao Nibs 3,1%, Aroma, Salz, Süßstoff (Steviol Glykoside).Cookies & Cream: Milcheiweiß, Isomalto-Oligosaccharide, Füllstoff: (Polydextrose), Oligofructose, Sonnenblumenöl, Kakao Nibs, Keks 3,2% (Weizenmehl (Gluten), Pflanzenöl (Rapsöl, Palmöl), Zucker, Salz, Natriumcarbonat, Ammoniumcarbonat), fettreduzierter Kakao, Aroma, Salz, Süßstoff (Steviol Glykoside).",Option wählen…,"16,16 €"
14,EAA Essential Amino Acids (360g),4.5,"Kirsche: BCAA Instant (L-Leucin, L-Isoleucin, L-Valin, Emulgator: Sonnenblumenlecithin), L-Lysin, HCl, Säuerungsmittel: Zitronensäure; L-Phenylalanin, L-Threonin, L-Methionin, Aroma, L-Tryptophan, Rote-Beete-Extrakt, Verdickungsmittel: Gummi arabicum; Süßungsmittel: Sucralose; Vitamin B-6 (Pyridoxinhydrochlorid).Fruchtmix: BCAA Instant (L-Leucin, L-Isoleucin, L-Valin, Emulgator: Sonnenblumenlecithin), Säuerungsmittel: Zitronensäure; L-Lysin, HCl, L-Phenylalanin, L-Threonin, L-Methionin, Aroma, L-Tryptophan, Farbstoff: Beta-Carotin; Verdickungsmittel: Gummi arabicum; Süßungsmittel: Sucralose; Vitamin B-6 (Pyridoxinhydrochlorid).Wassermelone: BCAA Instant (L-Leucin, L-Isoleucin, L-Valin, Emulgator: Sonnenblumenlecithin), Säuerungsmittel: Zitronensäure; L-Lysin, HCl, L-Phenylalanin, L-Threonin, L-Methionin, Aroma, L-Tryptophan, Verdickungsmittel: Gummi arabicum; Rote-Beete-Extrakt, Saflor-Extrakt, Süßungsmittel: Sucralose; Vitamin B-6 (Pyridoxinhydrochlorid).",Option wählen…,"25,00 €"
15,EAA Essential Amino Acids (360g),4.5,"Kirsche: BCAA Instant (L-Leucin, L-Isoleucin, L-Valin, Emulgator: Sonnenblumenlecithin), L-Lysin, HCl, Säuerungsmittel: Zitronensäure; L-Phenylalanin, L-Threonin, L-Methionin, Aroma, L-Tryptophan, Rote-Beete-Extrakt, Verdickungsmittel: Gummi arabicum; Süßungsmittel: Sucralose; Vitamin B-6 (Pyridoxinhydrochlorid).Fruchtmix: BCAA Instant (L-Leucin, L-Isoleucin, L-Valin, Emulgator: Sonnenblumenlecithin), Säuerungsmittel: Zitronensäure; L-Lysin, HCl, L-Phenylalanin, L-Threonin, L-Methionin, Aroma, L-Tryptophan, Farbstoff: Beta-Carotin; Verdickungsmittel: Gummi arabicum; Süßungsmittel: Sucralose; Vitamin B-6 (Pyridoxinhydrochlorid).Wassermelone: BCAA Instant (L-Leucin, L-Isoleucin, L-Valin, Emulgator: Sonnenblumenlecithin), Säuerungsmittel: Zitronensäure; L-Lysin, HCl, L-Phenylalanin, L-Threonin, L-Methionin, Aroma, L-Tryptophan, Verdickungsmittel: Gummi arabicum; Rote-Beete-Extrakt, Saflor-Extrakt, Süßungsmittel: Sucralose; Vitamin B-6 (Pyridoxinhydrochlorid).",Option wählen…,"25,00 €"
16,Protein-6 Pancakes (1000g),3.9,"Sweet Vanilla: Eiweiß-Mix (Micro-Cross-Flow-Filtration aus Molkeprotein-Konzentrat, Molkenprotein-Isolat, Molkenprotein-Hydrolysat, Casein (mizellar), Calciumcaseinat und Hühnerei Albumin), Weizenmehl (Gluten), Soja Lecithin, Aromen, Natriumcarbonat, Zitronensäure, Süßstoff: Acesulfat-K und Sucralose.Blaubeere: Molke & Milch Matrix (41,8%) (Molkenprotein-Konzentrat (Ultrafiltration und Mikrofiltration), Micellar Casein, Calciumcaseinat, Molkenprotein-Isolat), Hühnerei Albumin (1%), Weizengluten (24%), Weizenmehl, Natriumbicarbonat, Tafelsalz, Zitronensäure, Aroma, Sojalecithin, Süßstoff: Acesulfam-K, Sucralose, Blaubeer Aroma, Farbstoff: schwarzes Karottenpulver.Banana Chocolate: Eiweiß-Mix (Micro-Cross-Flow-Filtration aus Molkeprotein-Konzentrat, Molkenprotein-Isolat, Molkenprotein-Hydrolysat, Casein (mizellar), Calciumcaseinat und Hühnerei Albumin), Weizenmehl (Gluten), Soja Lecithin, Aromen, Natriumcarbonat, Zitronensäure, Süßstoff: Acesulfat-K und Sucralose.",Option wählen…,"25,00 €"
